ticker_code,company_name,company_full_name,sector,exchange
TTV,VISITEC,Công ty cổ phần Thông tin Tín hiệu Đường sắt Vinh,Industrial Goods & Services,UPCOM
TTZ,Tien Trung JSC,Công ty Cổ phần Đầu tư Xây dựng và Công nghệ Tiến Trung,Industrial Goods & Services,HNX
TUG,HP TUTRANCO,Công ty cổ phần Lai dắt và Vận tải Cảng Hải Phòng,Industrial Goods & Services,UPCOM
TV1,PECC1,Công ty Cổ phần Tư vấn xây dựng điện 1,Industrial Goods & Services,UPCOM
TV2,PECC2,Công ty Cổ phần Tư vấn Xây dựng điện 2,Construction & Materials,HOSTC
TV3,PECC3,Công ty Cổ phần Tư vấn xây dựng điện 3,Construction & Materials,HNX
TV4,PECC4,Công ty Cổ phần Tư vấn xây dựng điện 4,Construction & Materials,HNX
TVA,Sứ Thanh Trì,Công ty Cổ phần Sứ Viglacera Thanh Trì,Construction & Materials,UPCOM
TVB,TVB,Công ty Cổ phần Chứng khoán Trí Việt,Financial Services,HOSTC
TVC,Tập đoàn Trí Việt (TVC),Công ty cổ phần Tập đoàn Quản lý Tài sản Trí Việt,Financial Services,HNX
